
  { "title" : 
    [ "London, BL, Add. 14713",
      "Digital Catalogue of Syriac Manuscripts in the British Library",
      "Hymns of Severus, John bar Aphtūnāyā, etc., 337 (ܫܠܙ) in number",
      "Nativity of our Lord",
      "Epiphany",
      "Presentation and S. Simeon",
      "Lent",
      "Miracles of our Lord",
      "Palm Sunday",
      "Passion Week",
      "holy Cross",
      "Resurrection, arranged according to the eight tones",
      "Ascension",
      "Pentecost",
      "Common hymns for the holy Virgin, the Martyrs and Doctors, the Dead, and of penance, arranged according to the eight tones",
      "First tone",
      "Fifth tone",
      "Second tone",
      "Sixth tone",
      "Third tone",
      "Seventh tone",
      "Fourth tone",
      "Eighth tone",
      "Supplicatory hymns of all kinds, arranged according to the eight tones",
      "Propsalmata, chanted before the reading of the Scripture Lessons",
      "Hymns of praise, to be used at the celebration of the holy Eucharist",
      "Calendar of Feasts, Saints' Days, etc., according to the use of the Syrian church",
      "tract entitled \"Chronicle or Reckoning of the Year,\" containing the names of the months, the number of days in each, rules for finding the commencement of each month, the \"foundation (ܫܬܐܣܬܐ, ὁ θεμέλιος) of the year,\" the \"foundation of the moon\" or golden number, whether the year is intercalary or not, the age of the moon, the precise date of new moon, etc., etc.",
      "extract from Ezra the scribe, regarding the day of the Nativity",
      "Short extracts",
      "From Ephraim",
      "From John Chrysostom",
      "Part 1",
      "Part 2",
      "Enigmas",
      "celestial and terrestrial hierarchies" ],
    "syrTitle" : 
    [ "ܫ̈ܠܡ̣ܝ ܡ̈ܥܢܝܬܐ ܕܡܕܒܪܢܘܬܐ",
      "ܫܠ̣ܡ ܨܚܚܐ ܕܡ̈ܥܢܝܬܐ ܕܩܕܝܫܐ ܡܪܝ ܣܐܘܪܐ ܦܐܛܪܝܐܪܟܐ ܨ̈ܠܘܬܗ ܥܡܢ ܐܡܝܢ: ܏ܘܫ" ],
    "author" : 
    [ "Severus",
      "John bar Aphtūnāyā",
      "Ezra the Scribe",
      "Ephraim",
      "John Chrysostom",
      "John Chrysostom" ],
    "idno" : "https:\/\/bl.syriac.uk\/ms\/585",
    "displayTitleEnglish" : "London, BL, Add. 14713Digital Catalogue of Syriac Manuscripts in the British LibraryHymns of Severus, John bar Aphtūnāyā, etc., 337 (ܫܠܙ) in numberNativity of our LordEpiphanyPresentation and S. SimeonLentMiracles of our LordPalm SundayPassion Weekholy CrossResurrection, arranged according to the eight tonesAscensionPentecostCommon hymns for the holy Virgin, the Martyrs and Doctors, the Dead, and of penance, arranged according to the eight tonesFirst toneFifth toneSecond toneSixth toneThird toneSeventh toneFourth toneEighth toneSupplicatory hymns of all kinds, arranged according to the eight tonesPropsalmata, chanted before the reading of the Scripture LessonsHymns of praise, to be used at the celebration of the holy EucharistCalendar of Feasts, Saints' Days, etc., according to the use of the Syrian churchtract entitled \"Chronicle or Reckoning of the Year,\" containing the names of the months, the number of days in each, rules for finding the commencement of each month, the \"foundation (ܫܬܐܣܬܐ, ὁ θεμέλιος) of the year,\" the \"foundation of the moon\" or golden number, whether the year is intercalary or not, the age of the moon, the precise date of new moon, etc., etc.extract from Ezra the scribe, regarding the day of the NativityShort extractsFrom EphraimFrom John ChrysostomPart 1Part 2Enigmascelestial and terrestrial hierarchies",
    "persName" : 
    [ " Severus ",
      " John bar Aphtūnāyā ",
      " Ezra the Scribe ",
      " Ephraim ",
      " John Chrysostom " ],
    "shelfmark" : 
    [ " Add. 14,713 ",
      " BL Add MS 14713 " ],
    "finalRubrics" : 
    [ " <span lang=\"syr\" dir=\"rtl\">  ܫ̈ܠܡ̣ܝ ܡ̈ܥܢܝܬܐ ܕܡܕܒܪܢܘܬܐ<\/span>",
      " <span lang=\"syr\" dir=\"rtl\">  ܫܠ̣ܡ ܨܚܚܐ ܕܡ̈ܥܢܝܬܐ ܕܩܕܝܫܐ ܡܪܝ ܣܐܘܪܐ ܦܐܛܪܝܐܪܟܐ ܨ̈ܠܘܬܗ ܥܡܢ ܐܡܝܢ: ܏ܘܫ<\/span>" ],
    "otherLimit" : 
    [ " <span lang=\"syr\" dir=\"rtl\">  ܫܐܘܠܐ. ܡܢܐ ܐܝܬܘܗܝ ܕܪ̈ܓܠܐ ܠܝܬ ܠܗ. ܘܓ̈ܦܐ ܠܐ ܫܟܝ̣ܚܝܢ ܠܗ. ܘܠܐ ܡܢ ܗ̈ܠܟܐ ܐܝܬܘܗܝ ܘܠܐ ܡܢ ܦܪ̈ܘܚܐ ܛ̇ܐܣ ܩܠܝܠܐܝܬ. ܫܪܝܐ ܫܡ̣ܫܐ ܕܪ̈ܕܐ<\/span>" ],
    "script" : "syr",
    "material" : "chart",
    "classification" : 
    [ " Hymns " ] }